211,花画工艺品制造,指以绢、丝、绒、纸、涤纶、塑料、羽毛、通草以及鲜花草等为原料，经造型设计、模压、剪贴、干燥等工艺精制而成的花、果、叶等人造花类工艺品，以画面出现、可以挂或摆的具有欣赏性、装饰性和礼仪用的画类工艺品制作活动
212,天然植物纤维编织工艺品制造,指以竹、藤、棕、草、柳、葵、麻等天然植物纤维为材料，经编织或镶嵌而成具有造型艺术或图案花纹，以欣赏为主的工艺陈列品、礼仪用品以及工艺实用品的制作活动
213,抽纱刺绣工艺品制造,指以棉、麻、丝、毛及人造纤维纺织品等为主要原料，经设计、刺绣、抽、拉、钩等工艺加工各种生活装饰用品，以及以纺织品为主要原料，经特殊手工工艺或民间工艺方法加工成各种具有较强装饰效果的生活用纺织品和礼仪用品的制作活动
214,地毯、挂毯制造,指以羊毛、丝、棉、麻及人造纤维等为原料，经手工编织、机织、栽绒等方式加工而成的各种具有装饰性的地面覆盖物或可用于悬挂、垫坐等用途的生活装饰用品和礼仪用品的制作活动
215,珠宝首饰及有关物品制造,指以金、银、铂等贵金属及其合金以及钻石、宝石、玉石、翡翠、珍珠等为原料，经金属加工和连结组合、镶嵌等工艺加工制作各种图案的装饰品和礼仪用品的制作活动
216,其他工艺美术及礼仪用品制造,
217,体育用品制造,
218,球类制造,指各种皮制、胶制、革制的可充气的运动用球，以及其他材料制成的各种运动用硬球、软球等球类产品的生产活动
219,专项运动器材及配件制造,指各项竞技比赛和训练用器材及用品，体育场馆设施及器件的生产活动
220,健身器材制造,指供健身房、家庭或体育训练用的健身器材及运动物品的制造
221,运动防护用具制造,指用各种材质，为各项运动特制手套、鞋、帽和护具的生产活动
222,其他体育用品制造,指钓鱼专用的各种用具及用品，以及上述未列明的体育用品制造
223,玩具制造,指以儿童为主要使用者，用于玩耍、智力开发等娱乐器具的制造
224,电玩具制造,指制造供14岁以下儿童玩耍的、至少有一种玩耍功能需要使用额定电压小于或等于24V的玩具产品
225,塑胶玩具制造,指制造供14岁以下儿童玩耍的、玩具主体或主要玩耍部分由塑胶制成的，非预定承载儿童体重的非电玩具产品
226,金属玩具制造,指制造供14岁以下儿童玩耍的、玩具主体或主要玩耍部分由金属材料制成的，非预定承载儿童体重的非电玩具产品
227,弹射玩具制造,指制造供14岁以下儿童玩耍的，各种材质的通过可贮存和释放能量的弹射机构发射弹射物的蓄能弹射玩具和由儿童给予的能量发射弹射物的非蓄能弹射玩具的玩具产品
228,娃娃玩具制造,指制造供14岁以下儿童玩耍的、至少头部和四肢由非纺织物材质的聚合材料制成，并带有服装或身体由软性材料填充的非电的婴儿娃娃或人物娃娃玩具产品
229,儿童乘骑玩耍的童车类产品制造,指制造供儿童乘骑玩耍的童车类产品（含儿童推车、婴儿学步车）
230,其他玩具制造,
231,游艺器材及娱乐用品制造,
232,露天游乐场所游乐设备制造,指主要安装在公园、游乐园、水上乐园、儿童乐园等露天游乐场所的电动及非电动游乐设备和游艺器材的制造
233,游艺用品及室内游艺器材制造,指主要供室内、桌上等游艺及娱乐场所使用的游乐设备、游艺器材和游艺娱乐用品，以及主要安装在室内游乐场所的电子游乐设备的制造
234,其他娱乐用品制造,
235,石油、煤炭及其他燃料加工业,
236,精炼石油产品制造,
237,原油加工及石油制品制造,指从天然原油、人造原油中提炼液态或气态燃料以及石油制品的生产活动
238,其他原油制造,指采用油页岩、油砂、焦油以及一氧化碳、氢等气体等加工得到的类似天然石油的液体燃料的生产活动
239,煤炭加工,
240,炼焦,指主要从硬煤和褐煤中生产焦炭、干馏炭及煤焦油或沥青等副产品的炼焦炉的操作活动
241,煤制合成气生产,
242,煤制液体燃料生产,指通过化学加工过程把固体煤炭转化成为液体燃料、化工原料和产品的活动，如煤制甲醇、煤制烯烃等
243,煤制品制造,指用烟煤、无烟煤、褐煤及其他各种煤炭制成的煤砖、煤球等固体燃料制品的活动
244,其他煤炭加工,指煤质活性炭等其他煤炭加工活动
245,核燃料加工,指从沥青铀矿或其他含铀矿石中提取铀、浓缩铀的生产，对铀金属的冶炼、加工，以及其他放射性元素、同位素标记、核反应堆燃料元件的制造，还包括与核燃料加工有关的核废物处置活动
246,生物质燃料加工,
247,生物质液体燃料生产,指利用农作物秸秆和农业加工剩余物、薪材及林业加工剩余物、禽畜粪便、工业有机废水和废渣、城市生活垃圾和能源植物等生物质资源作为原料转化为液体燃料的活动
248,生物质致密成型燃料加工,包括对下列生物质燃料的加工活动：林木致密成型燃料，秸秆致密成型燃料，废物、废料致密成型燃料，其他生物致密成型燃料；不包括：木炭、竹炭加工
249,化学原料和化学制品制造业,
250,基础化学原料制造,
251,无机酸制造,
252,无机碱制造,指烧碱、纯碱等生产活动
253,无机盐制造,
254,有机化学原料制造,
255,其他基础化学原料制造,
256,肥料制造,指化学肥料、有机肥料及微生物肥料的制造
257,氮肥制造,指矿物氮肥及用化学方法制成含有作物营养元素氮的化肥的生产活动
258,磷肥制造,指以磷矿石为主要原料，用化学或物理方法制成含有作物营养元素磷的化肥的生产活动
259,钾肥制造,指用天然钾盐矿经富集精制加工制成含有作物营养元素钾的化肥的生产活动
260,复混肥料制造,指经过化学或物理方法加工制成的，含有两种以上作物所需主要营养元素（氮、磷、钾）的化肥的生产活动；包括通用型复混肥料和专用型复混肥料
261,有机肥料及微生物肥料制造,指来源于动植物，经发酵或腐熟等化学处理后，适用于土壤并提供植物养分供给的，其主要成分为含氮物质的肥料制造
262,其他肥料制造,指上述未列明的微量元素肥料及其他肥料的生产
263,农药制造,指用于防治农业、林业作物的病、虫、草、鼠和其他有害生物，调节植物生长的各种化学农药、微生物农药、生物化学农药，以及仓储、农林产品的防蚀、河流堤坝、铁路、机场、建筑物及其他场所用药的原药和制剂的生产活动
264,化学农药制造,指化学农药原药，以及经过机械粉碎、混合或稀释制成粉状、乳状和水状的化学农药制剂的生产活动
265,生物化学农药及微生物农药制造,指由细菌、真菌、病毒和原生动物或基因修饰的微生物等自然产生，以及由植物提取的防治病、虫、草、鼠和其他有害生物的农药制剂生产活动
266,涂料、油墨、颜料及类似产品制造,
267,涂料制造,指在天然树脂或合成树脂中加入颜料、溶剂和辅助材料，经加工后制成的覆盖材料的生产活动
268,油墨及类似产品制造,指由颜料、联接料（植物油、矿物油、树脂、溶剂）和填充料经过混合、研磨调制而成，用于印刷的有色胶浆状物质，以及用于计算机打印、复印机用墨等生产活动
269,工业颜料制造,指用于陶瓷、搪瓷、玻璃等工业的无机颜料及类似材料的生产活动
270,工艺美术颜料制造,指油画、水粉画、广告等艺术用颜料的制造
271,染料制造,指有机合成、植物性或动物性色料，以及有机颜料的生产活动
272,密封用填料及类似品制造,指用于建筑涂料、密封和漆工用的填充料，以及其他类似化学材料的制造
273,合成材料制造,
274,初级形态塑料及合成树脂制造,也称初级塑料或原状塑料的生产活动，包括通用塑料、工程塑料、功能高分子塑料的制造
275,合成橡胶制造,指用一种或多种单体为原料进行聚合生产合成橡胶或高分析弹性体的生产活动
276,合成纤维单（聚合）体制造,指以石油、天然气、煤等为主要原料，用有机合成的方法制成合成纤维单体或聚合体的生产活动
277,其他合成材料制造,指陶瓷纤维等特种纤维及其增强的复合材料的生产活动；其他专用合成材料的制造
278,专用化学产品制造,
279,化学试剂和助剂制造,指各种化学试剂、催化剂及专用助剂的生产活动
280,专项化学用品制造,指水处理化学品、造纸化学品、皮革化学品、油脂化学品、油田化学品、生物工程化学品、日化产品专用化学品等产品的生产活动
281,林产化学产品制造,指以林产品为原料，经过化学和物理加工方法生产产品的活动，包括木炭、竹炭生产活动
282,文化用信息化学品制造,指电影、照相、幻灯及投影用感光材料、冲洗套药，磁、光记录材料，光纤维通讯用辅助材料，及其专用化学制剂的制造
283,医学生产用信息化学品制造,指医学和其他生产用感光材料、冲洗套药等化学制剂制造
284,环境污染处理专用药剂材料制造,指对水污染、空气污染、固体废物、土壤污染等污染物处理所专用的化学药剂及材料的制造
285,动物胶制造,指以动物骨、皮为原料，经一系列工艺处理制成有一定透明度、黏度、纯度的胶产品的生产活动
286,其他专用化学产品制造,指其他各种用途的专用化学用品的制造
287,炸药、火工及焰火产品制造,
288,炸药及火工产品制造,指各种军用和生产用炸药、雷管及类似的火工产品的制造
289,焰火、鞭炮产品制造,指节日、庆典用焰火及民用烟花、鞭炮等产品的制造
290,日用化学产品制造,
291,肥皂及洗涤剂制造,指以喷洒、涂抹、浸泡等方式施用于肌肤、器皿、织物、硬表面，即冲即洗，起到清洁、去污、渗透、乳化、分散、护理、消毒除菌等功能，广泛用于家居、个人清洁卫生、织物清洁护理、工业清洗、公共设施及环境卫生清洗等领域的产品（固、液、粉、膏、片状等），以及中间体表面活性剂产品的制造
292,化妆品制造,指以涂抹、喷洒或者其他类似方法，撒布于人体表面任何部位（皮肤、毛发、指甲、口唇等），以达到清洁、消除不良气味、护肤、美容和修饰目的的日用化学工业产品的制造
293,口腔清洁用品制造,指用于口腔或牙齿清洁卫生制品的生产活动
294,香料、香精制造,指具有香气和香味，用于调配香精的物质――香料的生产，以及以多种天然香料和合成香料为主要原料，并与其他辅料一起按合理的配方和工艺调配制得的具有一定香型的复杂混合物，主要用于各类加香产品中的香精的生产活动
295,其他日用化学产品制造,指室内散香或除臭制品，光洁用品，擦洗膏及类似制品，动物用化妆盥洗品，火柴，蜡烛及类似制品等日用化学产品的生产活动
296,医药制造业,
297,化学药品原料药制造,指供进一步加工化学药品制剂、生物药品制剂所需的原料药生产活动
298,化学药品制剂制造,指直接用于人体疾病防治、诊断的化学药品制剂的制造
299,中药饮片加工,指对采集的天然或人工种植、养殖的动物、植物和矿物的药材部位进行加工、炮制，使其符合中药处方调剂或中成药生产使用的活动
300,中成药生产,以中药材为原料，在中医药理论指导下，为了预防及治疗疾病的需要，按规定的处方和制剂工艺将其加工制成一定剂型的中药制品的生产活动
301,兽用药品制造,指用于动物疾病防治医药的制造
302,生物药品制品制造,指利用生物技术生产生物化学药品、基因工程药物和疫苗的制剂生产活动
303,生物药品制造,指利用生物技术生产生物化学药品的生产活动
304,基因工程药物和疫苗制造,
305,卫生材料及医药用品制造,指卫生材料、外科敷料以及其他内、外科用医药制品的制造
307,药用辅料及包装材料制造,
308,化学纤维制造业,
309,纤维素纤维原料及纤维制造,
310,化纤浆粕制造,指纺织生产用粘胶纤维的基本原料生产活动
311,人造纤维（纤维素纤维）制造,指用化纤浆粕经化学加工生产纤维的活动
312,合成纤维制造,指以石油、天然气、煤等为主要原料，用有机合成的方法制成单体，聚合后经纺丝加工生产纤维的活动
313,锦纶纤维制造,也称聚酰胺纤维制造，指由尼龙66盐和聚己内酰胺为主要原料生产合成纤维的活动
314,涤纶纤维制造,是聚酯纤维制造的一种，指以聚对苯二甲酸乙二醇酯为原料生产合成纤维的活动
315,腈纶纤维制造,也称聚丙烯腈纤维制造，指以丙烯腈为主要原料（含丙烯腈85%以上）生产合成纤维的活动
316,维纶纤维制造,也称聚乙烯醇纤维制造，指以聚乙烯醇为主要原料生产合成纤维的活动
317,丙纶纤维制造,也称聚丙烯纤维制造，指以聚丙烯为主要原料生产合成纤维的活动
318,氨纶纤维制造,也称聚氨酯纤维制造，指以聚氨基甲酸酯为主要原料生产合成纤维的活动
319,其他合成纤维制造,
320,生物基材料制造,
321,生物基化学纤维制造,指以生物单体或天然有机高分子为原料生产纤维的活动，除天然动植物纤维外，特指生物基再生纤维、生物基合成纤维等
322,生物基、淀粉基新材料制造,指使用可再生生物资源（如玉米、木薯、秸秆等）经过糖化、发酵、聚合等步骤制成的聚乳酸等生物基、淀粉基材料的活动
323,橡胶和塑料制品业,
324,橡胶制品业,指以天然及合成橡胶为原料生产各种橡胶制品的活动，还包括利用废橡胶再生产橡胶制品的活动；不包括橡胶鞋制造
325,轮胎制造,
326,橡胶板、管、带制造,指用未硫化的、硫化的或硬质橡胶生产橡胶板状、片状、管状、带状、棒状和异型橡胶制品的活动，以及以橡胶为主要成分，用橡胶灌注、涂层、覆盖或层叠的纺织物、纱绳、钢丝（钢缆）等制作的传动带或输送带的生产活动
327,橡胶零件制造,指各种用途的橡胶异形制品、橡胶零配件制品的生产活动
328,再生橡胶制造,指用废橡胶生产再生橡胶的活动
329,日用及医用橡胶制品制造,
330,运动场地用塑胶制造,指运动场地、操场及其他特殊场地用的合成材料跑道面层制造和其他塑胶制造
331,其他橡胶制品制造,
332,塑料制品业,指以合成树脂（高分子化合物）为主要原料，经采用挤塑、注塑、吹塑、压延、层压等工艺加工成型的各种制品的生产，以及利用回收的废旧塑料加工再生产塑料制品的活动；不包括塑料鞋制造
333,塑料薄膜制造,指用于农业覆盖，工业、商业及日用包装薄膜的制造
334,塑料板、管、型材制造,指各种塑料板、管及管件、棒材、薄片等生产活动，以及以聚氯乙烯为主要原料，经连续挤出成型的塑料异型材的生产活动
335,塑料丝、绳及编织品制造,指塑料制丝、绳、扁条，塑料袋及编织袋、编织布等生产活动
336,泡沫塑料制造,指以合成树脂为主要原料，经发泡成型工艺加工制成内部具有微孔的塑料制品的生产活动
337,塑料人造革、合成革制造,指外观和手感似皮革，其透气、透湿性虽然略逊色于天然革，但具有优异的物理、机械性能，如强度和耐磨性等，并可代替天然革使用的塑料人造革的生产活动；模拟天然人造革的组成和结构，正反面都与皮革十分相似，比普通人造革更近似天然革，并可代替天然革的塑料合成革的生产活动
338,塑料包装箱及容器制造,指用吹塑或注塑工艺等制成的，可盛装各种物品或液体物质，以便于储存、运输等用途的塑料包装箱及塑料容器制品的生产活动
339,日用塑料制品制造,指塑料制餐、厨用具，卫生设备、洁具及其配件，塑料服装，日用塑料装饰品，以及其他日用塑料制品的生产活动
340,人造草坪制造,指采用合成纤维，植入在机织的基布上，并具有天然草运动性能的人造草制造
341,塑料零件及其他塑料制品制造,指塑料制绝缘零件、密封制品、紧固件，以及汽车、家具等专用零配件的制造，以及上述未列明的其他各类非日用塑料制品的生产活动
342,非金属矿物制品业,
343,水泥、石灰和石膏制造,
344,水泥制造,指以水泥熟料加入适量石膏或一定混合材，经研磨设备（水泥磨）磨制到规定的细度，制成水凝水泥的生产活动，还包括水泥熟料的生产活动
345,石灰和石膏制造,
346,石膏、水泥制品及类似制品制造,
347,水泥制品制造,指水泥制管、杆、桩、砖、瓦等制品制造
348,砼结构构件制造,指用于建筑施工工程的水泥混凝土预制构件的生产活动
349,石棉水泥制品制造,
350,轻质建筑材料制造,指石膏板、石膏制品及类似轻质建筑材料的制造
351,其他水泥类似制品制造,指玻璃纤维增强水泥制品，以及其他未列明的水泥制品的制造
352,砖瓦、石材等建筑材料制造,指粘土、陶瓷砖瓦的生产，建筑用石的加工，用废料或废渣生产的建筑材料，以及其他建筑材料的制造
353,粘土砖瓦及建筑砌块制造,指用粘土和其他材料生产的砖、瓦及建筑砌块的活动
354,建筑用石加工,指用于建筑、筑路、墓地及其他用途的大理石板、花岗岩等石材的切割、成形和修饰活动
355,防水建筑材料制造,指以沥青或类似材料为主要原料制造防水材料的活动
356,隔热和隔音材料制造,指用于隔热、隔音、保温的岩石棉、矿渣棉、膨胀珍珠岩、膨胀蛭石等矿物绝缘材料及其制品的制造，但不包括石棉隔热、隔音材料的制造
357,其他建筑材料制造,
358,玻璃制造,指任何形态玻璃的生产，以及利用废玻璃再生产玻璃活动，包括特制玻璃的生产
359,平板玻璃制造,指用浮法、垂直引上法、压延法等生产平板玻璃原片的活动
360,特种玻璃制造,指具有钢化、单向透视、耐高压、耐高温、隔音、防紫外线、防弹、防爆、中空、夹层、变形、超厚、超薄等某一种特殊功能或特殊工艺的玻璃制造
361,其他玻璃制造,指未列明的玻璃制造
362,玻璃制品制造,指任何形态玻璃制品的生产，以及利用废玻璃再生产玻璃制品的活动
363,技术玻璃制品制造,指用于建筑、工业生产的技术玻璃制品的制造
364,光学玻璃制造,指用于放大镜、显微镜、光学仪器等方面的光学玻璃，日用光学玻璃，钟表用玻璃或类似玻璃，光学玻璃眼镜毛坯的制造，以及未进行光学加工的光学玻璃元件的制造
365,玻璃仪器制造,指实验室、医疗卫生用各种玻璃仪器和玻璃器皿以及玻璃管的制造
366,日用玻璃制品制造,指餐厅、厨房、卫生间、室内装饰及其他生活用玻璃制品的制造
367,玻璃包装容器制造,指主要用于产品包装的各种玻璃容器的制造
368,玻璃保温容器制造,指玻璃保温瓶和其他个人或家庭用玻璃保温容器的制造
369,制镜及类似品加工,指以平板玻璃为材料，经对其进行镀银、镀铝，或冷、热加工后成型的镜子及类似制品的制造
370,其他玻璃制品制造,
371,玻璃纤维和玻璃纤维增强塑料制品制造,
372,玻璃纤维及制品制造,
373,玻璃纤维增强塑料制品制造,也称玻璃钢，指用玻璃纤维增强热固性树脂生产塑料制品的活动
374,陶瓷制品制造,
375,建筑陶瓷制品制造,指用于建筑物的内、外墙及地面装饰或耐酸腐蚀的陶瓷材料（不论是否涂釉）的生产活动，以及水道、排水沟的陶瓷管道及配件的制造
376,卫生陶瓷制品制造,指卫生和清洁盥洗用的陶瓷用具的生产活动
377,特种陶瓷制品制造,指专为工业、农业、实验室等领域的各种特定用途和要求，采用特殊生产工艺制造陶瓷制品的生产活动
378,日用陶瓷制品制造,指以粘土、瓷石、长石、石英等为原料，经破碎、制泥、成型、烧炼等工艺制成，主要供日常生活用的各种瓷器、炻器、陶器等陶瓷制品的制造
379,陈设艺术陶瓷制造,指以粘土、瓷土、瓷石、长石、石英等为原料，经制胎、施釉、装饰、烧制等工艺制成，主要供欣赏、装饰的陶瓷工艺美术品制造
380,园艺陶瓷制造,指专门为园林、公园、室外景观的摆设或具有一定功能的大型陶瓷制造
381,其他陶瓷制品制造,指以石英、长石、瓷土等为原料，经制胎、施釉、装饰、烧成等工艺制成的实用陶瓷的制造，以及其他未列明的陶瓷制品的制造
382,耐火材料制品制造,
383,石棉制品制造,指以石棉或其他矿物纤维素为基础，制造摩擦制品、石棉纺织制品、石棉橡胶制品、石棉保温隔热材料制品的生产活动
384,云母制品制造,
385,耐火陶瓷制品及其他耐火材料制造,指用硅质、粘土质、高铝质等石粉成形的陶瓷隔热制品的制造
386,石墨及其他非金属矿物制品制造,
387,石墨及碳素制品制造,指以炭、石墨材料加工的特种石墨制品、石墨烯、碳素制品、异形制品，以及用树脂和各种有机物浸渍加工而成的碳素异形产品的制造
388,其他非金属矿物制品制造,
389,黑色金属冶炼和压延加工业,
390,炼铁,指用高炉法、直接还原法、熔融还原法等，将铁从矿石等含铁化合物中还原出来的生产活动
391,炼钢,指利用不同来源的氧（如空气、氧气）来氧化炉料（主要是生铁）所含杂质的金属提纯活动
392,钢压延加工,指通过热轧、冷加工、锻压和挤压等塑性加工使连铸坯、钢锭产生塑性变形，制成具有一定形状尺寸的钢材产品的生产活动
393,铁合金冶炼,指铁与其他一种或一种以上的金属或非金属元素组成的合金生产活动
394,有色金属冶炼和压延加工业,
395,常用有色金属冶炼,指通过熔炼、精炼、电解或其他方法从有色金属矿、废杂金属料等有色金属原料中提炼常用有色金属的生产活动
396,铜冶炼,指对铜精矿等矿山原料、废杂铜料进行熔炼、精炼、电解等提炼铜的生产活动
397,铅锌冶炼,
398,镍钴冶炼,
399,锡冶炼,
400,锑冶炼,
401,铝冶炼,指对铝矿山原料通过冶炼、电解、铸型，以及对废杂铝料进行熔炼等提炼铝的生产活动
402,镁冶炼,
403,硅冶炼,
404,其他常用有色金属冶炼,
405,贵金属冶炼,指对金、银及铂族金属的提炼活动
406,金冶炼,指用金精（块）矿、阳极泥（冶炼其他有色金属时回收的阳极泥含金）、废杂金提炼黄金的生产活动
407,银冶炼,指用银精（块）矿、阳极泥（冶炼其他有色金属时回收的阳极泥含银）、废杂银提炼白银的生产活动
408,其他贵金属冶炼,
409,稀有稀土金属冶炼,指钨钼、稀有轻金属、稀有高熔点金属、稀散金属、稀土金属及其他稀有稀土金属冶炼活动，但不包括钍和铀等放射性金属的冶炼加工
410,钨钼冶炼,
411,稀土金属冶炼,
412,其他稀有金属冶炼,
413,有色金属合金制造,指以有色金属为基体，加入一种或几种其他元素所构成的合金生产活动
414,有色金属压延加工,
415,铜压延加工,指铜及铜合金的压延加工生产活动
416,铝压延加工,指铝及铝合金的压延加工生产活动
417,贵金属压延加工,指对金、银及铂族等贵金属，进行轧制、拉制或挤压加工的生产活动
418,稀有稀土金属压延加工,指对钨、钼、钽等稀有金属材的加工
419,其他有色金属压延加工,
420,金属制品业,
421,结构性金属制品制造,
422,金属结构制造,指以铁、钢或铝等金属为主要材料，制造金属构件、金属构件零件、建筑用钢制品及类似品的生产活动，这些制品可以运输，并便于装配、安装或竖立
423,金属门窗制造,指用金属材料（铝合金或其他金属）制作建筑物用门窗及类似品的生产活动
424,金属工具制造,
425,切削工具制造,指手工或机床用可互换的切削工具的制造
426,手工具制造,指在生产和日常生活中，进行装配、安装、维修时使用的手工工具的制造
427,农用及园林用金属工具制造,指主要用于农牧业生产的小农具，园艺或林业作业用金属工具的制造
428,刀剪及类似日用金属工具制造,指日常生活用刀剪、刀具、指甲钳等类似金属工具的制造
429,其他金属工具制造,指上述类别未包括的用于各种用途的金属工具的制造
430,集装箱及金属包装容器制造,
