443,建筑装饰搪瓷制品制造,用于建筑及其装饰方面的搪瓷制品和搪瓷制建筑材料的制造
444,搪瓷卫生洁具制造,卫生用和清洁盥洗用搪瓷用具的生产活动
445,搪瓷日用品及其他搪瓷制品制造,金属薄板经过成型、搪烧制成的日用品及其他搪瓷制品的制造
446,金属制日用品制造,不锈钢、铝等金属为主要原材料，加工制作各种日常生活用金属制品的生产活动
447,金属制厨房用器具制造,厨房烹制、调理用各种金属器具、用具的生产活动
448,金属制餐具和器皿制造,
449,金属制卫生器具制造,卫生用和清洁盥洗用的各种金属器具、用具的生产活动
450,其他金属制日用品制造,
451,铸造及其他金属制品制造,
452,黑色金属铸造,铸铁件、铸钢件等各种成品、半成品的制造
453,有色金属铸造,有色金属及其合金铸造的各种成品、半成品的制造
454,锻件及粉末冶金制品制造,通过对金属坯料进行锻造变形而得到的工件或毛坯，或者将金属粉末和与非金属粉末的混合物通过压制变形、烘焙制作制品和材料的活动，包括自由锻件、模锻件、特殊成形锻件、冷锻件、温锻件、粉末冶金件等制造
455,交通及公共管理用金属标牌制造,
456,其他未列明金属制品制造,其他上述未包括的金属制品的制造；本类别还包括武器弹药的制造
457,通用设备制造业,
458,锅炉及原动设备制造,
459,锅炉及辅助设备制造,各种蒸汽锅炉、汽化锅炉，及除同位素分离器外的各种核反应堆的制造
460,内燃机及配件制造,用于移动或固定用途的往复式、旋转式、火花点火式或压燃式内燃机及配件的制造，但不包括飞机、汽车和摩托车发动机的制造
461,汽轮机及辅机制造,汽轮机和燃气轮机（蒸汽涡轮机）的制造
462,水轮机及辅机制造,
463,风能原动设备制造,风能发电设备及其他风能原动设备制造
464,其他原动设备制造,
465,金属加工机械制造,
466,金属切削机床制造,用于加工金属的各种切削加工数控机床及普通机床的制造
467,金属成形机床制造,锻压、锤击和模压方式加工金属的机床，或弯曲、折叠、矫直、剪切、冲压、开槽、拉丝等方式加工金属的数控机床及普通机床的制造
468,铸造机械制造,金属铸件（机械零件毛坯件）铸造用专用设备及其专门配套件的制造，普通铸造设备、制芯设备、砂处理设备、清理设备和特种铸造设备等制造
469,金属切割及焊接设备制造,将电能及其他形式的能量转换为切割、焊接能量对金属进行切割、焊接设备的制造
470,机床功能部件及附件制造,实现机床核心功能的零件和部件的制造，及扩大机床加工性能和使用范围的附属装置的制造
471,其他金属加工机械制造,
472,物料搬运设备制造,在工厂、仓库、码头、站台及其他场地，进行起重、输送、装卸、搬运、堆码、存储等作业的机械设备及车辆及其专门配套件的制造
473,轻小型起重设备制造,结构轻巧、动作简单、可在狭小场地升降或移动重物的简易起重设备及器具的制造；包括起重滑车、手动葫芦、电动葫芦、普通卷扬机、千斤顶、汽车举升机、单轨小车等制造
474,生产专用起重机制造,具有起升、行走等主要工作机构的各种起重机及其专门配套件的制造
475,生产专用车辆制造,用于生产企业内部，进行装卸、堆跺或短距离搬运、牵引、顶推等作业的无轨车辆及其专门配套件的制造；包括电动叉车、内燃叉车、集装箱正面吊运机、短距离牵引车及固定平台搬运车、跨运车，及手动搬运、堆跺车等制造
476,连续搬运设备制造,在同一方向上，按照规定的线路连续或间歇地运送或装卸散状物料和成件物品的搬运设备及其专门配套件的制造；包括输送机械、装卸机械、给料机械等三类产品及其专门配套件的制造
477,电梯、自动扶梯及升降机制造,各种电梯、自动扶梯及自动人行道、升降机及其专门配套件的制造
478,客运索道制造,动力驱动，利用柔性绳索牵引箱体等运载工具运送人员的机电设备，包括客运架空索道、客运缆车、客运拖牵索道等制造
479,机械式停车设备制造,采用机械方法存取、停放汽车的机械装置或设备系统的制造，包括平面移动类、巷道堆垛类、垂直升降类、升降横移类、简易升降类停车设备
480,其他物料搬运设备制造,除上述外的其他物料搬运设备及其专门配套件的制造
481,泵、阀门、压缩机及类似机械制造,泵、真空设备、压缩机，液压和气压动力机械及类似机械和阀门的制造
482,泵及真空设备制造,用输送各种液体、液固混合体、液气混合体及其增压、循环、真空等用途的设备制造
483,气体压缩机械制造,对气体进行压缩，使其压力提高到340kPa上的压缩机械的制造
484,阀门和旋塞制造,通过改变其流道面积的大小，用控制流体流量、压力和流向的装置制造
485,液压动力机械及元件制造,液体为工作介质，依靠液体压力能，来进行能量转换、传递、控制和分配的元件和装置制造
486,液力动力机械及元件制造,液体为工作介质，依靠液体动量矩，来进行能量转换、传递、控制和分配的元件和装置制造
487,气压动力机械及元件制造,气体为工作介质，靠气压动力来传送能量的装置制造
488,轴承、齿轮和传动部件制造,
489,滚动轴承制造,将运转的轴与轴座之间的滑动摩擦变为滚动摩擦，从而减少摩擦损失的一种精密的机械元件的制造
490,滑动轴承制造,在滑动摩擦下工作的轴承制造
491,齿轮及齿轮减、变速箱制造,用于传递动力和转速的齿轮和齿轮减(增）速箱（机、器）、齿轮变速箱的制造；不包括汽车变速箱等制造
492,其他传动部件制造,除齿轮及齿轮减、变速箱外的其他相关传动装置制造；包括链传动、带传动、离合器、联轴节、制动器、平衡系统及其配套件制造
493,烘炉、风机、包装等设备制造,
494,烘炉、熔炉及电炉制造,使用液体燃料、粉状固体燃料（焚化炉）或气体燃料，进行煅烧、熔化或其他热处理用的非电力熔炉、窑炉和烘炉等燃烧器的制造，及工业或实验室用电炉及零件的制造
495,风机、风扇制造,用来输送各种气体，及气体增压、循环、通风换气、排尘等设备的制造
496,气体、液体分离及纯净设备制造,对气体进行杂质的去除，提高气体的纯度的气体净化设备制造；仅对气、液混合物进行分离，不改变气体、液体性质的气、液分离设备制造；对各种混合气体进行分离及液化的气体分离成套设备制造
497,制冷、空调设备制造,用于专业生产、商业经营等方面的制冷设备和空调设备的制造，但不包括家用空调设备的制造
498,风动和电动工具制造,带有电动机、非电力发动机或风动装置的手工操作加工工具的制造
499,喷枪及类似器具制造,
500,包装专用设备制造,对瓶、桶、箱、袋或其他容器的洗涤、干燥、装填、密封和贴标签等专用包装机械的制造
501,文化、办公用机械制造,
502,电影机械制造,各种类型或用途的电影摄影机、电影录音摄影机、影像放映机及电影辅助器材和配件的制造
503,幻灯及投影设备制造,通过媒体将在电子成像器件上的文字图像、胶片上的文字图像、纸张上的文字图像及实物投射到银幕上的各种设备、器材及零配件的制造
504,照相机及器材制造,各种类型或用途的照相机的制造；包括用制备印刷板，用于水下或空中照相的照相机制造，及照相机用闪光装置、摄影暗室装置和零件的制造
505,复印和胶印设备制造,各种用途的复印设备和集复印、打印、扫描、传真为一体的多功能一体机的制造；及主要用于办公室的胶印设备、文字处理设备及零件的制造
506,计算器及货币专用设备制造,金融、商业、交通及办公等使用的电子计算器、具有计算功能的数据记录、重现和显示机器的制造；及货币专用设备及类似机械的制造
507,其他文化、办公用机械制造,
508,通用零部件制造,
509,金属密封件制造,金属为原料制作密封件的生产活动
510,紧固件制造,
511,弹簧制造,
512,机械零部件加工,对专用和通用机械零部件的加工
513,其他通用零部件制造,
514,其他通用设备制造业,
515,工业机器人制造,用于工业自动化领域的工业机器人的制造
516,特殊作业机器人制造,用于特殊性作业的机器人制造，如水下、危险环境、高空作业、国防、科考、特殊搬运、农业等特殊作业机器人制造
517,增材制造装备制造,增材制造技术进行加工的设备制造和零部件制造
518,其他未列明通用设备制造业,
519,专用设备制造业,
520,采矿、冶金、建筑专用设备制造,
521,矿山机械制造,用于各种固体矿物及石料的开采和洗选的机械设备及其专门配套设备的制造；包括建井设备，采掘、凿岩设备，矿山提升设备，矿物破碎、粉磨设备，矿物筛分、洗选设备，矿用牵引车及矿车等产品及其专用配套件的制造
522,石油钻采专用设备制造,对陆地和近海石油、天然气等专用开采设备的制造；不包括深海石油、天然气勘探开采平台及相关漂浮设备的制造
523,深海石油钻探设备制造,对1500m上海洋的石油、天然气等专用开采设备的制造；不包括1500m下浅海和陆地石油、天然气勘探开采平台及相关漂浮设备的制造
524,建筑工程用机械制造,建筑施工及市政公共工程用机械的制造，包括土方机械、筑路机械、具有回转、变幅功能的工程起重机、建筑起重机等
525,建筑材料生产专用机械制造,生产水泥、水泥制品、玻璃及玻璃纤维、建筑陶瓷、砖瓦等建筑材料所使用的各种生产、搅拌成型机械的制造
526,冶金专用设备制造,金属冶炼、锭坯铸造、轧制及其专用配套设备等生产专用设备的制造
527,隧道施工专用机械制造,用于地下非开挖施工专用机械的制造，包括隧道掘进机（盾构机和硬岩掘进机）、顶管机、水平定向钻等
528,化工、木材、非金属加工专用设备制造,
529,炼油、化工生产专用设备制造,炼油、化学工业生产专用设备的制造，但不包括包装机械等通用设备的制造
530,橡胶加工专用设备制造,加工橡胶，或橡胶为材料生产橡胶制品的专用机械制造
531,塑料加工专用设备制造,塑料加工工业中所使用的各类专用机械和装置的制造
532,木竹材加工机械制造,在木竹材、木竹质板材、木制品及竹制品加工过程中的各类机械和设备的制造
533,模具制造,金属铸造用模具、矿物材料用模具、橡胶或塑料用模具及其他用途的模具的制造
534,其他非金属加工专用设备制造,
535,食品、饮料、烟草及饲料生产专用设备制造,
536,食品、酒、饮料及茶生产专用设备制造,主要用于食品、酒、饮料生产及茶制品加工等专用设备的制造
537,农副食品加工专用设备制造,对谷物、干豆类等农作物的筛选、碾磨、储存等专用机械，糖料和油料作物加工机械，畜禽屠宰、水产品加工及盐加工机械的制造
538,烟草生产专用设备制造,
539,饲料生产专用设备制造,
540,印刷、制药、日化及日用品生产专用设备制造,
541,制浆和造纸专用设备制造,在制浆、造纸、纸加工及纸制品的生产过程中所用的各类机械和设备的制造
542,印刷专用设备制造,使用印刷或其他方式将图文信息转移到承印物上的专用生产设备的制造
543,日用化工专用设备制造,日用化学工业产品，如洗涤用品、口腔清洁用品、化妆品、香精、香料、动物胶、感光材料及其他日用化学制品专用生产设备的制造
544,制药专用设备制造,化学原料药和药剂、中药饮片及中成药专用生产设备的制造
545,照明器具生产专用设备制造,用于生产各种类型电光源产品和各种照明器具产品的专用生产设备的制造
546,玻璃、陶瓷和搪瓷制品生产专用设备制造,用于生产加工玻璃制品、玻璃器皿的专用机械，陶瓷器等类似产品的加工机床和生产专用机械，及搪瓷制品生产设备的制造
547,其他日用品生产专用设备制造,上述未列明的日用品、工艺美术品的生产专用机械设备的制造
548,纺织、服装和皮革加工专用设备制造,
549,纺织专用设备制造,纺织纤维预处理、纺纱、织造和针织机械的制造
550,皮革、毛皮及其制品加工专用设备制造,在制革、毛皮鞣制及其制品的加工生产过程中所使用的各种专用设备的制造
551,缝制机械制造,用于服装、鞋帽、箱包等制作的专用缝纫机械制造，及生产加工各种面料服装、鞋帽所包括的铺布、裁剪、整烫、输送管理等机械和羽绒加工设备的制造
552,洗涤机械制造,洗衣店等专业洗衣机械的制造；不包括家用洗衣机的制造
553,电子和电工机械专用设备制造,
554,电工机械专用设备制造,电机、电线、电缆等电站、电工专用机械及器材的生产设备的制造
555,半导体器件专用设备制造,生产集成电路、二极管（含发光二极管）、三极管、太阳能电池片的设备的制造
556,电子元器件与机电组件设备制造,生产电容、电阻、电感、印制电路板、电声元件、锂离子电池等电子元器件与机电组件的设备的制造
557,其他电子专用设备制造,电子（气）物理设备及其他未列明的电子设备的制造
558,农、林、牧、渔专用机械制造,
559,拖拉机制造,
560,机械化农业及园艺机具制造,用于土壤处理，作物种植或施肥，种植物收割的农业、园艺或其他机械的制造
561,营林及木竹采伐机械制造,
562,畜牧机械制造,草原建设、管理，畜禽养殖及畜禽产品采集等专用机械的制造
563,渔业机械制造,渔业养殖、渔业捕捞等专用设备的制造
564,农林牧渔机械配件制造,拖拉机配件和其他农林牧渔机械配件的制造
565,棉花加工机械制造,棉花加工专用机械制造，棉花加工成套设备的制造和安装
566,其他农、林、牧、渔业机械制造,用于农产品初加工机械，及其他未列明的农、林、牧、渔业机械的制造
567,医疗仪器设备及器械制造,
568,医疗诊断、监护及治疗设备制造,用于内科、外科、眼科、妇产科等医疗专用诊断、监护、治疗等方面的设备制造
569,口腔科用设备及器具制造,用于口腔治疗、修补设备及器械的制造
570,医疗实验室及医用消毒设备和器具制造,医疗实验室或医疗用消毒、灭菌设备及器具的制造
571,医疗、外科及兽医用器械制造,各种手术室、急救室、诊疗室等医疗专用及兽医用手术器械、医疗诊断用品和医疗用具的制造
572,机械治疗及病房护理设备制造,各种治疗设备、病房护理及康复专用设备的制造
573,康复辅具制造,用于改善、补偿、替代人体功能和辅助性治疗康复辅助器具的制造，适用于残疾人和老年人生活护理、运动康复、教育和就业辅助、残疾儿童康复等；主要包括假肢、矫形器、轮椅和助行器、助听器和人工耳蜗等产品和零部件的制造，也包括智能仿生假肢、远程康复系统、虚拟现实康复训练设备等其他康复类产品的制造
574,眼镜制造,眼镜成镜、眼镜框架和零配件、眼镜镜片、角膜接触镜（隐形眼镜）及护理产品的制造
575,其他医疗设备及器械制造,外科、牙科等医疗专用及兽医用家具器械的制造和人工器官及植（介）入器械制造，及其他未列明的医疗设备及器械的制造
576,环保、邮政、社会公共服务及其他专用设备制造,
577,环境保护专用设备制造,用于大气污染防治、水污染防治、固体废弃物处理、土壤修复和抽样、噪声与振动控制、环境应急等环境污染防治专用设备制造
578,地质勘查专用设备制造,地质勘查（勘探）专用设备的制造；不包括通用钻采、挖掘机械的制造
579,邮政专用机械及器材制造,
580,商业、饮食、服务专用设备制造,
581,社会公共安全设备及器材制造,公安、消防、安全等社会公共安全设备及器材的制造和加工
582,交通安全、管制及类似专用设备制造,除铁路运输外的道路运输、水上运输及航空运输等有关的管理、安全、控制专用设备的制造；不包括电气照明设备、信号设备的制造
583,水资源专用机械制造,水利工程管理、节水工程及水的生产、供应专用设备的制造
584,其他专用设备制造,上述类别中未列明的其他专用设备的制造，包括同位素设备的制造
585,汽车制造业,
586,汽车整车制造,
587,汽柴油车整车制造,由传统燃料动力装置驱动，具有四个上车轮的非轨道、无架线的车辆，并主要用于载送人员和（或）货物、牵引输送人员和（或）货物的车辆制造
588,新能源车整车制造,采用新型动力系统，完全或主要依靠新型能源驱动的汽车，包括插电式混合动力（含增程式）汽车、纯电动汽车和燃料电池电动汽车等
589,汽车用发动机制造,
590,改装汽车制造,利用外购汽车底盘改装各类汽车的制造
591,低速汽车制造,最高时速限制在规定范围内的农用三轮或四轮等载货汽车的制造
592,电车制造,电作为动力，屏板或可控硅方式控制的城市内交通工具和专用交通工具的制造
593,汽车车身、挂车制造,其设计和技术特性需由汽车牵引，才能正常行驶的一种无动力的道路车辆的制造
594,汽车零部件及配件制造,机动车辆及其车身的各种零配件的制造
595,铁路、船舶、航空航天和其他运输设备制造业,
596,铁路运输设备制造,
597,高铁车组制造,外来电源或蓄电池驱动的，或压燃式发动机及其他方式驱动的，能够牵引高速铁路车辆的动力机车、高铁车组、铁路动车组的制造
598,铁路机车车辆制造,非高铁、动车机组的铁路机车制造，及用于运送旅客和用装运货物的客车、货车及其他铁路专用车辆的制造
599,窄轨机车车辆制造,可用于交通运输的窄轨内燃机车、电力机车和窄轨非机动车的制造
600,高铁设备、配件制造,
601,铁路机车车辆配件制造,铁道或有轨机车及其拖拽车辆的专用零配件的制造
602,铁路专用设备及器材、配件制造,铁路安全或交通控制设备的制造，及其他铁路专用设备及器材、配件的制造
603,其他铁路运输设备制造,
604,城市轨道交通设备制造,
605,船舶及相关装置制造,
606,金属船舶制造,钢质、铝质等各种金属为主要材料，为民用或军事部门建造远洋、近海或内陆河湖的金属船舶的制造
607,非金属船舶制造,各种木材、水泥、玻璃钢等非金属材料，为民用或军事部门建造船舶的活动
608,娱乐船和运动船制造,游艇和用于娱乐或运动的其他船只的制造
609,船用配套设备制造,船用主机、辅机设备的制造
610,船舶改装,按规范要求对船舶船体、设备、系统、结构等改装
611,船舶拆除,
612,海洋工程装备制造,海上工程、海底工程、近海工程的专用设备制造，不含港口工程设备及船舶、潜水、救捞等设备制造
613,航标器材及其他相关装置制造,用于航标的各种器材，及不航行为主的船只的制造，不含海上浮动装置的制造
614,航空、航天器及设备制造,
615,飞机制造,在大气同温层内飞行的用于运货或载客，用于国防，及用于体育运动或其他用途的各种飞机及其零件的制造，包括飞机发动机的制造
618,航天器及运载火箭制造,
619,航天相关设备制造,包括航天试验专用设备设施（宇航模拟设备、航天风洞、电磁、真空专用设备设施、其他航天试验专用设备设施）和总装调试测试设备（航天器总装调试测试设备、运载火箭总装调试测试设备）等专用设备、设施的制造
620,航空相关设备制造,
621,其他航空航天器制造,
622,摩托车制造,
623,摩托车整车制造,不论是否装有边斗的摩托车制造，包括摩托车发动机的制造
624,摩托车零部件及配件制造,
625,自行车和残疾人座车制造,
626,自行车制造,未装马达，主要脚蹬驱动，装有一个或多个轮子的脚踏车辆及其零件的制造
627,残疾人座车制造,
628,助动车制造,出行代步为主要功能，主要蓄电池等作为辅助能源，具有两个、三个、四个车轮，电动或电动助力功能的特种助力车及其零件的制造
629,非公路休闲车及零配件制造,运动休闲娱乐为主要功能，包括运动休闲车（不含跑车、山地车和越野车）、一轮、两轮、四轮休闲车、滑板车、草地车、观光车等制造
630,潜水救捞及其他未列明运输设备制造,
631,潜水装备制造,潜水装置的制造
632,水下救捞装备制造,水下作业、救捞装备的制造
633,其他未列明运输设备制造,手推车辆、牲畜牵引车辆的制造，及上述未列明的交通运输设备的制造
634,电气机械和器材制造业,
635,电机制造,
636,发电机及发电机组制造,发电机及其辅助装置、发电成套设备的制造
637,电动机制造,交流或直流电动机及零件的制造
638,微特电机及组件制造,微型特种电机、减速器及零组件的制造
639,其他电机制造,
640,输配电及控制设备制造,
641,变压器、整流器和电感器制造,变压器、静止式变流器等电力电子设备和互感器的制造
642,电容器及其配套设备制造,电力电容器及其配套装置和电容器零件的制造
643,配电开关控制设备制造,用于电压超过1000V的，诸如一般在配电系统中使用的接通及断开或保护电路的电器，及用于电压不超过1000V的，如在住房、工业设备或家用电器中使用的配电开关控制设备及其零件的制造
644,电力电子元器件制造,用于电能变换和控制（从而实现运动控制）的电子元器件的制造
645,光伏设备及元器件制造,太阳能组件（太阳能电池）、控制设备及其他太阳能设备和元器件制造；不包括太阳能用蓄电池制造
646,其他输配电及控制设备制造,开关设备和控制设备内部的元器件之间，及与外部电路之间的电连接所需用的器件和配件的制造
647,电线、电缆、光缆及电工器材制造,
648,电线、电缆制造,在电力输配、电能传送，声音、文字、图像等信息传播，及照明等各方面所使用的电线电缆的制造
649,光纤制造,将电的信号变成光的信号，进行声音、文字、图像等信息传输的光纤的制造
650,光缆制造,利用置于包覆套中的一根或多根光纤作为传输媒质并可单独或成组使用的光缆的制造
651,绝缘制品制造,电气绝缘子、电机或电气设备用的绝缘零件，及带有绝缘材料的金属制电导管及接头的制造，但不包括玻璃、陶瓷绝缘体和绝缘漆制品的制造
652,其他电工器材制造,
653,电池制造,正极活性材料、负极活性材料，配合电介质，密封式结构制成的，并具有一定公称电压和额定容量的化学电源的制造；包括一次性、不可充电和二次可充电，重复使用的干电池、蓄电池（含太阳能用蓄电池）的制造，及利用氢与氧的合成转换成电能的装置，即燃料电池制造；不包括利用太阳光转换成电能的太阳能电池制造
654,锂离子电池制造,锂离子嵌入化合物为正极材料电池的制造
655,镍氢电池制造,储氢合金为负极材料，氢氧化镍为正极材料，电解液是含氢氧化锂（LiOH）的氢氧化钾（KOH）水溶液的电池的制造
656,铅蓄电池制造,铅及氧化物为正负极材料，电解液为硫酸水溶液的电池制造
657,锌锰电池制造,二氧化锰为正极，锌为负极的原电池的制造
658,其他电池制造,
659,家用电力器具制造,使用交流电源或电池的各种家用电器的制造
660,家用制冷电器具制造,
661,家用空气调节器制造,使用交流电源(制冷量14000W及下)，调节室内温度、湿度、气流速度和空气洁净度的房间空气调节器的制造
662,家用通风电器具制造,由单相交流电动机驱动扇叶旋转，产生强制气流，改善人体与周围空气间的热交换条件的电器制造
663,家用厨房电器具制造,家庭厨房用的电热蒸煮器具、电热烘烤器具、电热水和饮料加热器具、电热煎炒器具、家用电灶、家用食品加工电器具、家用厨房电清洁器具等电器具的制造
664,家用清洁卫生电器具制造,家用洗衣机、吸尘器等电力器具的制造
665,家用美容、保健护理电器具制造,
